{
  "schema_version": 1,
  "request_id": "11111111-2222-4333-8444-555555555555",
  "key": {
    "host_id": "demo-host",
    "boot_id": "demo-boot",
    "entity_id": "cpu.package.0",
    "metric_id": "cpu.temperature.package",
    "scope": "package:0"
  },
  "start_boot_ns": "0",
  "end_boot_ns": "3600000000000",
  "resolution_ms": 60000,
  "stat": "mean",
  "max_points": 60,
  "source_filter": null
}
